<?xml version="1.0" encoding="utf-8" ?>
<schema xmlns="http://www.w3.org/2001/XMLSchema"
        targetNamespace="http://www.example.org/teacher"
        elementFormDefault="qualified">

    <element name="teachers">
        <complexType>
            <sequence maxOccurs="unbounded">
                <element name="teacher">
                    <complexType>
                        <sequence>
                            <element name="name" type="string" ></element>
                            <element name="age" type="int"></element>
                        </sequence>
                    </complexType>
                </element>
            </sequence>
        </complexType>
    </element>


</schema>