<teachers xmlns:xsi="http://www.w3.org/2001/XMLSchema-instance"
    xmlns="http://www.example.org/teacher"
    xsi:schemaLocation="http://www.example.org/teacher teacher.xsd">
    <teacher>
        <name>马什么梅</name>
        <age>23</age>
    </teacher>
    <teacher>
        <name>马冬什么</name>
        <age>25</age>
    </teacher>
    <teacher>
        <name>什么冬梅</name>
        <age>21</age>
    </teacher>
</teachers>